Day,Time,Title,Speaker,Room,Venue,Theme1,Theme2,Theme3,Description,Is highlight
Sunday,11.45,Are we heading for a new Cold War?,Judith Orr,3C/D,SC,Imperialism,,,Author and activist Judith Orr will be discussing the potential imperialist clashes in the era of Trump and Putin,
Sunday,11.45,Who gets to be remembered: Should all the statues fall?,Brian Richardson,3E,SC,Racism,Imperialism,,"We've recently seen an explosion of debate surrounding the legacy of slavery and empire, much of it centred on the statues of that era. Author and activist Brian Richardson will be debating whether they should all fall.",
Sunday,11.45,Workshop: Is human nature a barrier to socialism?,Fran Manning,Nunn,IOE,Socialism,,,"New to Marxism Festival this year, the workshops series will be addressing key questions for anyone new to Marxist politics. Including group discussion and participation, these workshop provide a great opportunity to ask those questions you've always wanted to ask. ",
Sunday,11.45,Booklaunch: Reason in revolt,Alan Gibbons,Clarke,IOE,,,,Author Alan Gibbons launches the second book of his Russian Revolution trilogy,
Sunday,11.45,Workshop: What is the dialectic?,Richard Donnelly,Seminar room 802,IOE,Marx@200,,,"New to Marxism Festival this year, the workshops series will be addressing key questions for anyone new to Marxist politics. Including group discussion and participation, these workshop provide a great opportunity to ask those questions you've always wanted to ask. ",
Sunday,14.00,Palestine in the era of Trump,Ilan Pappé,The Venue,SC,Imperialism,Trump,,"(https://www.facebook.com/events/196048077711172/) Ilan Pappé is one of the most prominent anti-Zionist scholars in the world, and has written a number of celebrated books on the topic. Ilan will be discussing The day after: opportunities and dangers for Palestine in the era of Trump.",
Sunday,14.00,Resisting the far right & fascism in Europe,"Christine Buchholz, David Albrich & more",Upper Hall,SC,Racism,,,"(https://www.facebook.com/events/1936843079719073/). We've recently seen the far right movement in Britain attempt to make the kind of breakthrough made by their European counterparts. This special panel willl bring together antifascists from across Europe to debate the fightback against the far right. Speakers include Christine Buchholz (MP in Germany), David Albrich (Austria) and Petros Constantinou (Greece)",
Sunday,14.00,"Universities and colleges, neoliberalism & resistance","Nita Sanghera, Josh Hollands",Malet Suite,SC,,,,"From HE to FE, this year has seen massive attacks but also huge resistance. A panel of activists will be discussing where next in the fight to defend education. Speakers include Nita Sanghera (UCU Vice-President elect) and UCU activists.",
Sunday,14.00,"Class, Pride and protest: Fighting for LGBT+ liberation",Nicola Field and others,3C/D,SC,Liberation,,,"A special panel will be discussing Class, Pride & Protest: the fight for LGBT+ Liberation. Speakers include Nicola Field (Lesbians and Gays Support the Miners), Charlie Kiss (Trans activist), Peter Purton (author of Trade Unions & LGBT Rights)  & Edward Sesange (Diamond African LGBTI Group).",
Sunday,14.00,NHS @ 70: How can we fight to defend it?,Karen Reissman,3E,SC,,,,A panel of NHS campaigners will come together on the NHS' 70th birthday to debate how we can fight to save it. ,
Sunday,14.00,"Black voices, white visions: Music, racism and identity",Dave Randall,Nunn,IOE,Culture,,,Musician and author Dave Randall  will be leading a discussion on the anti-racist legacies of music. Dave has toured the world playing with Faithless and Sinead O'Connor.,
Sunday,14.00,Dirty energy & capitalism: what's the real story,Suzanne Jeffrey & others,Clarke,IOE,Climate,,,"Suzanne Jeffrey will be joined by anti-fracking activists to discuss how dirty enegry is tied into capitalism, and how we can build a movement to take it on.",
Sunday,14.00,Booklaunch: A Rebel's Guide to Martin Luther King,Yuri Prasad,Seminar room 802,IOE,Racism,,,"On the 50th anniversary of the assassination of Martin Luther King, politicians will queue to pay their respects. They will smother his memory with praise but none will acknowledge the truth - that King was a radical who wanted a complete transformation of society. Where in their vision is the King who stood out against the Vietnam War, who pledged to organise a poor people's march on Washington and who mounted a devastating critique of capitalism?
What about the King who talked of revolution and who the FBI labelled ""the most dangerous Negro in America""? Where is the King who was gunned down in Memphis while supporting striking workers? Author & journalist Yuri Prasad will be discussing King's radical legacy.",
Sunday,14.00,Prospects for the socialist Left in Ireland,Richard Boyd Barrett TD,Seminar room 642,IOE,Socialism,,,"From the abortion referendum to the water charges movement, Ireland has seen profound struggles for social change. Richard Boyd-Barrett, member of the Irish Parliament, will be discussing the prospects for the socialist Left in Ireland. ",
Sunday,14.00,Workshop: Marx & Alienation,Naima Omar,Bloomsbury,SC,Marx@200,,,"New to Marxism Festival this year, the workshops series will be addressing key questions for anyone new to Marxist politics. Including group discussion and participation, these workshop provide a great opportunity to ask those questions you've always wanted to ask. ",
Sunday,15.45,From the Football Lads Alliance to Tommy Robinson: the far right on the march,,The Venue,SC,Racism,,,"The Windrush scandal has exposed the racism at the heart of the British state, and has revealed the true nature of the 'hostile environment'. It has also raised questions of 'good' migrants and 'bad' migrants, and what it means to be 'British'. Join Weyman Bennett to debate these questions and more.",
Sunday,15.45,"Corbyn, antisemitism & justice for Palestine","Naomi Wimbourne-Idrissi, Rob Ferguson, Salma Karmi-Ayyoub",Upper Hall,SC,Corbyn,Imperialism,,"The Labour right and supporters of Israel have smeared the Left and pro-Palestine movement as being antisemitic. While of course any instance of antisemitism must be vigorously opposed, we can not allow the right to use false smears to silence criticism of Israel and support for Palestine. Naomi Wimbourne-Idrissi from Jewish Voice for Labour and Rob Ferguson will be joined by other activists to discuss the politics behind the smears, and how we can counter them.",
Sunday,15.45,Debating Trotskyism in Britain,"Joseph Choonara, John Kelly",Malet Suite,SC,,,,,
Sunday,15.45,The experience of Left reformism in Europe,Panos Garganos,3C/D,SC,,,,Panos is editor of Socialist Worker's sister paper Workers' Solidarity and will be looking at the experience Syriza in Greece and Left reformism in Europe. ,
Sunday,15.45,This is America: resistance to Trump,John Bellamy Foster & others,3E,SC,Trump,,,John Bellamy Foster is editor of Monthly Review in the US. He'll be joining a panel discussing how resistance has characterized Trump's first few years in power. ,
Sunday,15.45,Islamophobia and child abuse: challenging the myths,Bea Kay,Nunn,SC,Racism,,,,
Sunday,15.45,Social reproduction theory: capital & women's oppression,Sheila McGregor,Clarke,IOE,Sexism,,,,
Sunday,15.45,Film: Martin Luther King: Workers and the civil rights movement,,Seminar room 802,IOE,,,,"From Catalonia to Scotland, independence struggles have raised questions for the Left. ",
Sunday,15.45,Resistance and racism in France,Denis Godard,Seminar room 642,IOE,Marx@200,,,"New to Marxism Festival this year, the workshops series will be addressing key questions for anyone new to Marxist politics. Including group discussion and participation, these workshop provide a great opportunity to ask those questions you've always wanted to ask. ",
Sunday,15.45,Marxism & the fight for national liberation,Hector Sierra,Bloomsbury,SC,,,,,
Sunday,17.30,Closing rally: After Trump-  the battle for the future,,The Light ,Friends Meeting House,,,,The closing rally will bring together activists and campaigners speaking on the fight for a different world.,
Sunday,18.30,Marxism 2018 Afterparty,Fred Hampton Appreciation Society,The Venue,SC,Culture,,,"with music from the Fred Hampton Appreciation Society an eight-piece band based in north-west London who make music to move your head, heart and feet",
