Day,Time,Title,Speaker,Theme1,Theme2,Theme3,Description,Is highlight
Sunday,11.45,Booklaunch: Reason in revolt,Alan Gibbons,,,,Author Alan Gibbons launches the second book of his Russian Revolution trilogy,
Sunday,11.45,Workshop: What is the dialectic?,Richard Donnelly,Marx@200,,,New to Marxism Festival this year-- the workshops series will be addressing key questions for anyone new to Marxist politics. Including group discussion and participation-- these workshop provide a great opportunity to ask those questions you've always wanted to ask. ,
Sunday,14.00,Palestine in the era of Trump,Ilan Pappé,Imperialism,Trump,,(https://www.facebook.com/events/196048077711172/) Ilan Pappé is one of the most prominent anti-Zionist scholars in the world-- and has written a number of celebrated books on the topic. Ilan will be discussing The day after: opportunities and dangers for Palestine in the era of Trump.,
Sunday,14.00,Resisting the far right & fascism in Europe,Christine Buchholz-- David Albrich & more,Racism,,,(https://www.facebook.com/events/1936843079719073/). We've recently seen the far right movement in Britain attempt to make the kind of breakthrough made by their European counterparts. This special panel willl bring together antifascists from across Europe to debate the fightback against the far right. Speakers include Christine Buchholz (MP in Germany)-- David Albrich (Austria) and Petros Constantinou (Greece),
Sunday,14.00,Class-- Pride and protest: Fighting for LGBT+ liberation,Nicola Field and others,Liberation,,,A special panel will be discussing Class-- Pride & Protest: the fight for LGBT+ Liberation. Speakers include Nicola Field (Lesbians and Gays Support the Miners)-- Charlie Kiss (Trans activist)-- Peter Purton (author of Trade Unions & LGBT Rights)  & Edward Sesange (Diamond African LGBTI Group).,
Sunday,14.00,Universities and colleges-- neoliberalism & resistance,Nita Sanghera and others,,,,From HE to FE-- this year has seen massive attacks but also huge resistance. A panel of activists will be discussing where next in the fight to defend education. Speakers include Nita Sanghera (UCU Vice-President elect) and UCU activists.,
Sunday,14.00,Dirty energy & capitalism: what's the real story,,Climate,,,Suzanne Jeffrey will be joined by anti-fracking activists to discuss how dirty enegry is tied into capitalism-- and how we can build a movement to take it on.,
Sunday,14.00,NHS @ 70: How can we fight to defend it?,,,,,A panel of NHS campaigners will come together on the NHS' 70th birthday to debate how we can fight to save it. ,
Sunday,14.00,Black voices-- white visions: Music-- racism and identity,Dave Randall,Culture,,,Musician and author Dave Randall  will be leading a discussion on the anti-racist legacies of music. Dave has toured the world playing with Faithless and Sinead O'Connor.,
Sunday,14.00,Booklaunch: A Rebel's Guide to Martin Luther King,Yuri Prasad,Racism,,,"On the 50th anniversary of the assassination of Martin Luther King-- politicians will queue to pay their respects. They will smother his memory with praise but none will acknowledge the truth - that King was a radical who wanted a complete transformation of society. Where in their vision is the King who stood out against the Vietnam War-- who pledged to organise a poor people's march on Washington and who mounted a devastating critique of capitalism? What about the King who talked of revolution and who the FBI labelled ""the most dangerous Negro in America""? Where is the King who was gunned down in Memphis while supporting striking workers? Author & journalist Yuri Prasad will be discussing King's radical legacy. ",
Sunday,14.00,Prospects for the socialist Left in Ireland,Richard Boyd Barrett TD,Socialism,,,From the abortion referendum to the water charges movement-- Ireland has seen profound struggles for social change. Richard Boyd-Barrett-- member of the Irish Parliament-- will be discussing the prospects for the socialist Left in Ireland. ,
Sunday,14.00,Workshop: Marx & Alienation,Naima Omar,Marx@200,,,New to Marxism Festival this year-- the workshops series will be addressing key questions for anyone new to Marxist politics. Including group discussion and participation-- these workshop provide a great opportunity to ask those questions you've always wanted to ask. ,
Sunday,15.45,After Windrush: what does it mean to be British?,Weyman Bennett,Racism,,,The Windrush scandal has exposed the racism at the heart of the British state-- and has revealed the true nature of the 'hostile environment'. It has also raised questions of 'good' migrants and 'bad' migrants-- and what it means to be 'British'. Join Weyman Bennett to debate these questions and more.,
Sunday,15.45,Corbyn-- antisemitism & justice for Palestine,Naomi Wimbourne-Idrissi-- Rob Ferguson,Corbyn,Imperialism,,The Labour right and supporters of Israel have smeared the Left and pro-Palestine movement as being antisemitic. While of course any instance of antisemitism must be vigorously opposed-- we can not allow the right to use false smears to silence criticism of Israel and support for Palestine. Naomi Wimbourne-Idrissi from Jewish Voice for Labour and Rob Ferguson will be joined by other activists to discuss the politics behind the smears-- and how we can counter them.,
Sunday,15.45,The experience of Left reformism in Europe,Panos Garganos,,,,Panos is editor of Socialist Worker's sister paper Workers' Solidarity and will be looking at the experience Syriza in Greece and Left reformism in Europe. ,
Sunday,15.45,This is America: resistance to Trump,John Bellamy Foster & others,Trump,,,John Bellamy Foster is editor of Monthly Review in the US. He'll be joining a panel discussing how resistance has characterized Trump's first few years in power. ,
Sunday,15.45,Islamophobia and child abuse: challenging the myths,Bea Kay,Racism,,,,
Sunday,15.45,Social reproduction theory: capital & women's oppression,Sheila McGregor,Sexism,,,,
Sunday,15.45,Marxism and the fight for national liberation,Hector Sierra,,,,From Catalonia to Scotland-- independence struggles have raised questions for the Left. ,
Sunday,15.45,Workshop: Marxism & history,,Marx@200,,,New to Marxism Festival this year-- the workshops series will be addressing key questions for anyone new to Marxist politics. Including group discussion and participation-- these workshop provide a great opportunity to ask those questions you've always wanted to ask. ,
Sunday,15.45,Resistance and racism in France,,,,,,
Sunday,17.30,Closing rally: After Trump-  the battle for the future,,,,,The closing rally will bring together activists and campaigners speaking on the fight for a different world.,
Sunday,18.30,Marxism 2018 Afterparty,Fred Hampton Appreciation Society,Culture,,,with music from the Fred Hampton Appreciation Society an eight-piece band based in north-west London who make music to move your head-- heart and feet,